#queryIndex	queryItem	stringId	preferredName	annotation
1	SCYL3	9606.ENSP00000356746	SCYL3	Protein-associating with the carboxyl-terminal domain of ezrin; May play a role in regulating cell adhesion/migration complexes in migrating cells; SCY1 like pseudokinases
2	MASP2	9606.ENSP00000383690	MASP2	Mannan-binding lectin serine protease 2; Serum protease that plays an important role in the activation of the complement system via mannose-binding lectin. After activation by auto-catalytic cleavage it cleaves C2 and C4, leading to their activation and to the formation of C3 convertase; Sushi domain containing
3	PRICKLE3	9606.ENSP00000470248	PRICKLE3	Prickle planar cell polarity protein 3; Involved in the planar cell polarity (PCP) pathway that is essential for the polarization of epithelial cells during morphogenetic processes, including gastrulation and neurulation (By similarity). PCP is maintained by two molecular modules, the global and the core modules, PRICKLE3 being part of the core module (By similarity). Distinct complexes of the core module segregate to opposite sides of the cell, where they interact with the opposite complex in the neighboring cell at or near the adherents junctions (By similarity). Involved in the orga [...] 
4	MAP2K3	9606.ENSP00000345083	MAP2K3	Dual specificity mitogen-activated protein kinase kinase 3; Dual specificity kinase. Is activated by cytokines and environmental stress in vivo. Catalyzes the concomitant phosphorylation of a threonine and a tyrosine residue in the MAP kinase p38. Part of a signaling cascade that begins with the activation of the adrenergic receptor ADRA1B and leads to the activation of MAPK14; Belongs to the protein kinase superfamily. STE Ser/Thr protein kinase family. MAP kinase kinase subfamily
5	THAP3	9606.ENSP00000054650	THAP3	THAP domain-containing protein 3; Component of a THAP1/THAP3-HCFC1-OGT complex that is required for the regulation of the transcriptional activity of RRM1; THAP domain containing
6	ZNF800	9606.ENSP00000376989	ZNF800	Zinc finger protein 800; May be involved in transcriptional regulation; Zinc fingers C2H2-type
7	FAM160A2	9606.ENSP00000265978	FAM160A2	Family with sequence similarity 160 member a2; FTS and Hook-interacting protein; Component of the FTS/Hook/FHIP complex (FHF complex). The FHF complex may function to promote vesicle trafficking and/or fusion via the homotypic vesicular protein sorting complex (the HOPS complex); Belongs to the UPF0518 family
8	RELT	9606.ENSP00000064780	RELT	Tumor necrosis factor receptor superfamily member 19L; Mediates activation of NF-kappa-B. May play a role in T- cell activation; RELT family
9	ZNF112	9606.ENSP00000337081	ZNF112	Zinc finger protein 112; May be involved in transcriptional regulation; Zinc fingers C2H2-type
10	PLPP1	9606.ENSP00000264775	PPAP2A	Phospholipid phosphatase 1; Phosphatidic acid phosphatase type 2A
11	BCL3	9606.ENSP00000164227	BCL3	B-cell lymphoma 3 protein; Contributes to the regulation of transcriptional activation of NF-kappa-B target genes. In the cytoplasm, inhibits the nuclear translocation of the NF-kappa-B p50 subunit. In the nucleus, acts as transcriptional activator that promotes transcription of NF-kappa-B target genes. Contributes to the regulation of cell proliferation (By similarity); Ankyrin repeat domain containing
12	MNT	9606.ENSP00000174618	MNT	Max network transcriptional repressor; Max-binding protein MNT; Binds DNA as a heterodimer with MAX and represses transcription. Binds to the canonical E box sequence 5'-CACGTG-3' and, with higher affinity, to 5'-CACGCG-3'; Basic helix-loop-helix proteins
13	MAP4K4	9606.ENSP00000343658	MAP4K4	Mitogen-activated protein kinase kinase kinase kinase 4; Serine/threonine kinase that may play a role in the response to environmental stress and cytokines such as TNF-alpha. Appears to act upstream of the JUN N-terminal pathway. Phosphorylates SMAD1 on Thr-322; Belongs to the protein kinase superfamily. STE Ser/Thr protein kinase family. STE20 subfamily
14	RPS6KA6	9606.ENSP00000262752	RPS6KA6	Ribosomal protein S6 kinase alpha-6; Constitutively active serine/threonine-protein kinase that exhibits growth-factor-independent kinase activity and that may participate in p53/TP53-dependent cell growth arrest signaling and play an inhibitory role during embryogenesis; Belongs to the protein kinase superfamily. AGC Ser/Thr protein kinase family. S6 kinase subfamily
15	FERMT2	9606.ENSP00000342858	FERMT2	Fermitin family homolog 2; Scaffolding protein that enhances integrin activation mediated by TLN1 and/or TLN2, but activates integrins only weakly by itself. Binds to membranes enriched in phosphoinositides. Enhances integrin-mediated cell adhesion onto the extracellular matrix and cell spreading; this requires both its ability to interact with integrins and with phospholipid membranes. Required for the assembly of focal adhesions. Participates in the connection between extracellular matrix adhesion sites and the actin cytoskeleton and also in the orchestration of actin assembly and ce [...] 
16	NCBP3	9606.ENSP00000373657	C17orf85	Nuclear cap-binding protein subunit 3; Associates with NCBP1/CBP80 to form an alternative cap- binding complex (CBC) which plays a key role in mRNA export. NCBP3 serves as adapter protein linking the capped RNAs (m7GpppG-capped RNA) to NCBP1/CBP80. Unlike the conventional CBC with NCBP2 which binds both small nuclear RNA (snRNA) and messenger (mRNA) and is involved in their export from the nucleus, the alternative CBC with NCBP3 does not bind snRNA and associates only with mRNA thereby playing a role in only mRNA export. The alternative CBC is particularly important in cellular stress  [...] 
17	TRAF4	9606.ENSP00000262395	TRAF4	TNF receptor-associated factor 4; Adapter protein and signal transducer that links members of the tumor necrosis factor receptor (TNFR) family to different signaling pathways. Plays a role in the activation of NF-kappa-B and JNK, and in the regulation of cell survival and apoptosis. Regulates activation of NF-kappa-B in response to signaling through Toll-like receptors. Required for normal skeleton development, and for normal development of the respiratory tract (By similarity). Required for activation of RPS6KB1 in response to TNF signaling. Modulates TRAF6 functions
18	IL4R	9606.ENSP00000379111	IL4R	Interleukin-4 receptor subunit alpha; Receptor for both interleukin 4 and interleukin 13. Couples to the JAK1/2/3-STAT6 pathway. The IL4 response is involved in promoting Th2 differentiation. The IL4/IL13 responses are involved in regulating IgE production and, chemokine and mucus production at sites of allergic inflammation. In certain cell types, can signal through activation of insulin receptor substrates, IRS1/IRS2
19	ITGA8	9606.ENSP00000367316	ITGA8	Integrin subunit alpha 8; Integrin alpha-8; Integrin alpha-8/beta-1 functions in the genesis of kidney and probably of other organs by regulating the recruitment of mesenchymal cells into epithelial structures. It recognizes the sequence R-G-D in a wide array of ligands including TNC, FN1, SPP1 TGFB1, TGFB3 and VTN. NPNT is probably its functional ligand in kidney genesis. Neuronal receptor for TNC it mediates cell-cell interactions and regulates neurite outgrowth of sensory and motor neurons
20	ZNF510	9606.ENSP00000364379	ZNF510	Zinc finger protein 510; May be involved in transcriptional regulation; Zinc fingers C2H2-type
21	SERTAD4	9606.ENSP00000355979	SERTAD4	Serta domain-containing protein 4; SERTA domain containing 4
22	IL11	9606.ENSP00000264563	IL11	Interleukin-11; Cytokine that stimulates the proliferation of hematopoietic stem cells and megakaryocyte progenitor cells and induces megakaryocyte maturation resulting in increased platelet production. Also promotes the proliferation of hepatocytes in response to liver damage. Binding to its receptor formed by IL6ST and either IL11RA1 or IL11RA2 activates a signaling cascade that promotes cell proliferation. Signaling leads to the activation of intracellular protein kinases and the phosphorylation of STAT3; Belongs to the IL-6 superfamily
23	HIVEP1	9606.ENSP00000368698	HIVEP1	Zinc finger protein 40; This protein specifically binds to the DNA sequence 5'- GGGACTTTCC-3' which is found in the enhancer elements of numerous viral promoters such as those of SV40, CMV, or HIV-1. In addition, related sequences are found in the enhancer elements of a number of cellular promoters, including those of the class I MHC, interleukin-2 receptor, and interferon-beta genes. It may act in T-cell activation. Involved in activating HIV-1 gene expression. Isoform 2 and isoform 3 also bind to the IPCS (IRF1 and p53 common sequence) DNA sequence in the promoter region of interfero [...] 
24	CBARP	9606.ENSP00000465260	C19orf26	Voltage-dependent calcium channel beta subunit-associated regulatory protein; Negatively regulates voltage-gated calcium channels by preventing the interaction between their alpha and beta subunits. Thereby, negatively regulates calcium channels activity at the plasma membrane and indirectly inhibits calcium-regulated exocytosis
25	GADD45B	9606.ENSP00000215631	GADD45B	Growth arrest and DNA damage-inducible protein GADD45 beta; Involved in the regulation of growth and apoptosis. Mediates activation of stress-responsive MTK1/MEKK4 MAPKKK
26	MFNG	9606.ENSP00000349490	MFNG	Mfng o-fucosylpeptide 3-beta-n-acetylglucosaminyltransferase; Beta-1,3-N-acetylglucosaminyltransferase manic fringe; Glycosyltransferase that initiates the elongation of O- linked fucose residues attached to EGF-like repeats in the extracellular domain of Notch molecules. Modulates NOTCH1 activity by modifying O-fucose residues at specific EGF-like domains resulting in inhibition of NOTCH1 activation by JAG1 and enhancement of NOTCH1 activation by DLL1 via an increase in its binding to DLL1 (By similarity); Beta 3-glycosyltransferases
27	SRSF5	9606.ENSP00000452123	SRSF5	Splicing factor, arginine/serine-rich 4/5/6; Serine/arginine-rich splicing factor 5; Plays a role in constitutive splicing and can modulate the selection of alternative splice sites; RNA binding motif containing
28	CHD8	9606.ENSP00000382863	CHD8	Chromodomain-helicase-DNA-binding protein 8; DNA helicase that acts as a chromatin remodeling factor and regulates transcription. Acts as a transcription repressor by remodeling chromatin structure and recruiting histone H1 to target genes. Suppresses p53/TP53-mediated apoptosis by recruiting histone H1 and preventing p53/TP53 transactivation activity. Acts as a negative regulator of Wnt signaling pathway by regulating beta-catenin (CTNNB1) activity. Negatively regulates CTNNB1- targeted gene expression by being recruited specifically to the promoter regions of several CTNNB1 responsiv [...] 
29	ADNP2	9606.ENSP00000262198	ADNP2	Activity-dependent neuroprotector homeobox protein 2; May be involved in transcriptional regulation; ZF class homeoboxes and pseudogenes
30	SMAD7	9606.ENSP00000262158	SMAD7	Mothers against decapentaplegic homolog 7; Antagonist of signaling by TGF-beta (transforming growth factor) type 1 receptor superfamily members; has been shown to inhibit TGF-beta (Transforming growth factor) and activin signaling by associating with their receptors thus preventing SMAD2 access. Functions as an adapter to recruit SMURF2 to the TGF-beta receptor complex. Also acts by recruiting the PPP1R15A- PP1 complex to TGFBR1, which promotes its dephosphorylation. Positively regulates PDPK1 kinase activity by stimulating its dissociation from the 14-3-3 protein YWHAQ which acts as a [...] 
31	CGB3	9606.ENSP00000301408	CGB5	Chorionic gonadotropin, beta polypeptide; Chorionic gonadotropin beta subunit 5
32	DOT1L	9606.ENSP00000381657	DOT1L	Histone-lysine N-methyltransferase, H3 lysine-79 specific; Histone methyltransferase. Methylates 'Lys-79' of histone H3. Nucleosomes are preferred as substrate compared to free histones. Binds to DNA; Lysine methyltransferases
33	SLC17A7	9606.ENSP00000221485	SLC17A7	Mfs transporter, acs family, solute carrier family 17 (sodium-dependent inorganic phosphate cotransporter), member 6/7/8; Vesicular glutamate transporter 1; Mediates the uptake of glutamate into synaptic vesicles at presynaptic nerve terminals of excitatory neural cells. May also mediate the transport of inorganic phosphate; Solute carriers
34	ZNF419	9606.ENSP00000388864	ZNF419	Zinc finger protein 419; May be involved in transcriptional regulation; Belongs to the krueppel C2H2-type zinc-finger protein family
35	ELL	9606.ENSP00000262809	ELL	RNA polymerase II elongation factor ELL; Elongation factor component of the super elongation complex (SEC), a complex required to increase the catalytic rate of RNA polymerase II transcription by suppressing transient pausing by the polymerase at multiple sites along the DNA. Elongation factor component of the little elongation complex (LEC), a complex required to regulate small nuclear RNA (snRNA) gene transcription by RNA polymerase II and III. Specifically required for stimulating the elongation step of RNA polymerase II- and III-dependent snRNA gene transcription. ELL also plays an [...] 
36	ERF	9606.ENSP00000222329	ERF	ETS domain-containing transcription factor ERF; Potent transcriptional repressor that binds to the H1 element of the Ets2 promoter. May regulate other genes involved in cellular proliferation. Required for extraembryonic ectoderm differentiation, ectoplacental cone cavity closure, and chorioallantoic attachment (By similarity). May be important for regulating trophoblast stem cell differentiation (By similarity)
37	ZNF574	9606.ENSP00000469029	ZNF574	Zinc finger protein 574; May be involved in transcriptional regulation; Zinc fingers C2H2-type
38	HOXA3	9606.ENSP00000484411	HOXA3	Homeobox protein Hox-A3; Sequence-specific transcription factor which is part of a developmental regulatory system that provides cells with specific positional identities on the anterior-posterior axis; HOXL subclass homeoboxes
39	LFNG	9606.ENSP00000222725	LFNG	Lfng o-fucosylpeptide 3-beta-n-acetylglucosaminyltransferase; Beta-1,3-N-acetylglucosaminyltransferase lunatic fringe; Glycosyltransferase that initiates the elongation of O- linked fucose residues attached to EGF-like repeats in the extracellular domain of Notch molecules. Modulates NOTCH1 activity by modifying O-fucose residues at specific EGF-like domains resulting in inhibition of NOTCH1 activation by JAG1 and enhancement of NOTCH1 activation by DLL1 via an increase in its binding to DLL1 (By similarity). Decreases the binding of JAG1 to NOTCH2 but not that of DLL1. Essential media [...] 
40	HOXA5	9606.ENSP00000222726	HOXA5	Homeobox protein Hox-A5; Sequence-specific transcription factor which is part of a developmental regulatory system that provides cells with specific positional identities on the anterior-posterior axis. Also binds to its own promoter. Binds specifically to the motif 5'-CYYNATTA[TG]Y-3'; HOXL subclass homeoboxes
41	PPIF	9606.ENSP00000225174	PPIF	Peptidyl-prolyl cis-trans isomerase F, mitochondrial; PPIases accelerate the folding of proteins. It catalyzes the cis-trans isomerization of proline imidic peptide bonds in oligopeptides. Involved in regulation of the mitochondrial permeability transition pore (mPTP). It is proposed that its association with the mPTP is masking a binding site for inhibiting inorganic phosphate (Pi) and promotes the open probability of the mPTP leading to apoptosis or necrosis; the requirement of the PPIase activity for this function is debated. In cooperation with mitochondrial TP53 is involved in act [...] 
42	PRMT8	9606.ENSP00000372067	PRMT8	Protein arginine N-methyltransferase 8; Membrane-associated arginine methyltransferase that can both catalyze the formation of omega-N monomethylarginine (MMA) and asymmetrical dimethylarginine (aDMA). Able to mono- and dimethylate EWS protein; however its precise role toward EWS remains unclear as it still interacts with fully methylated EWS
43	SRF	9606.ENSP00000265354	SRF	Serum response factor; SRF is a transcription factor that binds to the serum response element (SRE), a short sequence of dyad symmetry located 300 bp to the 5' of the site of transcription initiation of some genes (such as FOS). Required for cardiac differentiation and maturation; MADS box family
44	PAPD7	9606.ENSP00000230859	PAPD7	Non-canonical poly(A) RNA polymerase PAPD7; Catalytic subunit of a TRAMP-like complex which has a poly(A) RNA polymerase activity and is involved in a post- transcriptional quality control mechanism. Polyadenylation with short oligo(A) tails is required for the degradative activity of the exosome on several of its nuclear RNA substrates. Has no terminal uridylyltransferase activity, and does not play a role in replication-dependent histone mRNA degradation via uridylation; Belongs to the DNA polymerase type-B-like family
45	HBEGF	9606.ENSP00000230990	HBEGF	Proheparin-binding EGF-like growth factor; Growth factor that mediates its effects via EGFR, ERBB2 and ERBB4. Required for normal cardiac valve formation and normal heart function. Promotes smooth muscle cell proliferation. May be involved in macrophage-mediated cellular proliferation. It is mitogenic for fibroblasts, but not endothelial cells. It is able to bind EGF receptor/EGFR with higher affinity than EGF itself and is a far more potent mitogen for smooth muscle cells than EGF. Also acts as a diphtheria toxin receptor
46	PCDHB15	9606.ENSP00000231173	PCDHB15	Protocadherin beta-15; Potential calcium-dependent cell-adhesion protein. May be involved in the establishment and maintenance of specific neuronal connections in the brain; Clustered protocadherins
47	ZNF346	9606.ENSP00000350869	ZNF346	Zinc finger protein 346; Binds with low affinity to dsDNA and ssRNA, and with high affinity to dsRNA, with no detectable sequence specificity. May bind to specific miRNA hairpins
48	HES1	9606.ENSP00000232424	HES1	Transcription factor HES-1; Transcriptional repressor of genes that require a bHLH protein for their transcription. May act as a negative regulator of myogenesis by inhibiting the functions of MYOD1 and ASH1. Binds DNA on N-box motifs: 5'-CACNAG-3' with high affinity and on E-box motifs: 5'-CANNTG-3' with low affinity (By similarity). May play a role in a functional FA core complex response to DNA cross-link damage, being required for the stability and nuclear localization of FA core complex proteins, as well as for FANCD2 monoubiquitination in response to DNA damage; Basic helix-loop- [...] 
49	TUSC2	9606.ENSP00000232496	TUSC2	Tumor suppressor candidate 2; May function as a tumor suppressor, inhibiting colony formation, causing G1 arrest and ultimately inducing apoptosis in homozygous 3p21.3 120-kb region-deficient cells; Belongs to the TUSC2 family
50	LMAN2L	9606.ENSP00000366280	LMAN2L	Lectin, mannose binding 2 like; VIP36-like protein; May be involved in the regulation of export from the endoplasmic reticulum of a subset of glycoproteins. May function as a regulator of ERGIC-53
51	DLX2	9606.ENSP00000234198	DLX2	Homeobox protein DLX-2; Acts as a transcriptional activator. Plays a role in terminal differentiation of interneurons, such as amacrine and bipolar cells in the developing retina. Likely to play a regulatory role in the development of the ventral forebrain. May play a role in craniofacial patterning and morphogenesis; NKL subclass homeoboxes and pseudogenes
52	TCEANC2	9606.ENSP00000234827	TCEANC2	Transcription elongation factor A N-terminal and central domain containing 2
53	PHF13	9606.ENSP00000366876	PHF13	PHD finger protein 13; Modulates chromatin structure. Required for normal chromosome condensation during the early stages of mitosis. Required for normal chromosome separation during mitosis; PHD finger proteins
54	ERRFI1	9606.ENSP00000366702	ERRFI1	ERBB receptor feedback inhibitor 1; Negative regulator of EGFR signaling in skin morphogenesis. Acts as a negative regulator for several EGFR family members, including ERBB2, ERBB3 and ERBB4. Inhibits EGFR catalytic activity by interfering with its dimerization. Inhibits autophosphorylation of EGFR, ERBB2 and ERBB4. Important for normal keratinocyte proliferation and differentiation. Plays a role in modulating the response to steroid hormones in the uterus. Required for normal response to progesterone in the uterus and for fertility. Mediates epithelial estrogen responses in the uterus [...] 
55	EXOC8	9606.ENSP00000355605	EXOC8	Exocyst complex component 8; Component of the exocyst complex involved in the docking of exocytic vesicles with fusion sites on the plasma membrane; Belongs to the EXO84 family
56	ETV3	9606.ENSP00000357175	ETV3	ETS translocation variant 3; Transcriptional repressor that contribute to growth arrest during terminal macrophage differentiation by repressing target genes involved in Ras-dependent proliferation. Represses MMP1 promoter activity; ETS transcription factor family
57	SLC19A2	9606.ENSP00000236137	SLC19A2	Solute carrier family 19 (thiamine transporter), member 2/3; Thiamine transporter 1; High-affinity transporter for the intake of thiamine; Solute carriers
58	FBXO30	9606.ENSP00000237281	FBXO30	F-box only protein 30; Substrate-recognition component of the SCF (SKP1-CUL1-F- box protein)-type E3 ubiquitin ligase complex. Required for muscle atrophy following denervation; F-boxes other
59	SENP5	9606.ENSP00000327197	SENP5	Sentrin-specific protease 5; Protease that catalyzes two essential functions in the SUMO pathway: processing of full-length SUMO3 to its mature form and deconjugation of SUMO2 and SUMO3 from targeted proteins. Has weak proteolytic activity against full-length SUMO1 or SUMO1 conjugates. Required for cell division; SUMO specific peptidases
60	PPP6C	9606.ENSP00000392147	PPP6C	Protein phosphatase 6 catalytic subunit
61	IRF2BPL	9606.ENSP00000238647	IRF2BPL	Interferon regulatory factor 2-binding protein-like; May contribute to the control of female reproductive function (By similarity). May play a role in gene transcription by transactivating GNRH1 promoter and repressing PENK promoter; Belongs to the IRF2BP family
62	PPP1R3C	9606.ENSP00000238994	PPP1R3C	Protein phosphatase 1 regulatory subunit 3C; Acts as a glycogen-targeting subunit for PP1 and regulates its activity. Activates glycogen synthase, reduces glycogen phosphorylase activity and limits glycogen breakdown. Dramatically increases basal and insulin-stimulated glycogen synthesis upon overexpression in a variety of cell types; Protein phosphatase 1 regulatory subunits
63	DUSP1	9606.ENSP00000239223	DUSP1	Dual specificity protein phosphatase 1; Dual specificity phosphatase that dephosphorylates MAP kinase MAPK1/ERK2 on both 'Thr-183' and 'Tyr-185', regulating its activity during the meiotic cell cycle; Belongs to the protein-tyrosine phosphatase family. Non-receptor class dual specificity subfamily
64	PPP3CC	9606.ENSP00000380878	PPP3CC	Serine/threonine-protein phosphatase 2B catalytic subunit gamma isoform; Calcium-dependent, calmodulin-stimulated protein phosphatase. This subunit may have a role in the calmodulin activation of calcineurin; Belongs to the PPP phosphatase family. PP-2B subfamily
65	LHX4	9606.ENSP00000263726	LHX4	LIM/homeobox protein Lhx4; May play a critical role in the development of respiratory control mechanisms and in the normal growth and maturation of the lung; LIM class homeoboxes
66	ZSCAN20	9606.ENSP00000355053	ZSCAN20	Zinc finger and SCAN domain-containing protein 20; May be involved in transcriptional regulation; Myb/SANT domain containing
67	C7orf49	9606.ENSP00000376823	C7orf49	Cell cycle regulator of non-homologous end joining; Isoform 1: Cell-cycle-specific inhibitor of classical non-homologous end joining (NHEJ) of DNA double-strand break (DSB) repair during the S and G2 phases. Acts as a regulator of DNA repair pathway choice by specifically inhibiting classical NHEJ during the S and G2 phases, thereby promoting error-free repair by homologous recombination during cell cycle phases when sister chromatids are present. Preferentially protects single-stranded overhangs at break sites by inhibiting classical NHEJ, thereby creating a local environment that fav [...] 
68	CHST3	9606.ENSP00000362207	CHST3	Carbohydrate sulfotransferase 3; Sulfotransferase that utilizes 3'-phospho-5'-adenylyl sulfate (PAPS) as sulfonate donor to catalyze the transfer of sulfate to position 6 of the N-acetylgalactosamine (GalNAc) residue of chondroitin. Chondroitin sulfate constitutes the predominant proteoglycan present in cartilage and is distributed on the surfaces of many cells and extracellular matrices. Can also sulfate Gal residues of keratan sulfate, another glycosaminoglycan, and the Gal residues in sialyl N- acetyllactosamine (sialyl LacNAc) oligosaccharides. May play a role in the maintenance of [...] 
69	NR4A1	9606.ENSP00000440864	NR4A1	Nuclear receptor subfamily 4 group A member 1; Orphan nuclear receptor. May act concomitantly with NURR1 in regulating the expression of delayed-early genes during liver regeneration. Binds the NGFI-B response element (NBRE) 5'- AAAAGGTCA-3' (By similarity). May inhibit NF-kappa-B transactivation of IL2. Participates in energy homeostasis by sequestrating the kinase STK11 in the nucleus, thereby attenuating cytoplasmic AMPK activation; Nuclear hormone receptors
70	AMD1	9606.ENSP00000357880	AMD1	S-adenosylmethionine decarboxylase proenzyme; Essential for biosynthesis of the polyamines spermidine and spermine. Promotes maintenance and self-renewal of embryonic stem cells, by maintaining spermine levels; Belongs to the eukaryotic AdoMetDC family
71	PFKFB2	9606.ENSP00000356047	PFKFB2	6-phosphofructo-2-kinase/fructose-2,6-bisphosphatase 2; Synthesis and degradation of fructose 2,6-bisphosphate; In the C-terminal section; belongs to the phosphoglycerate mutase family
