#queryIndex	queryItem	stringId	preferredName	annotation
72	SNAI1	9606.ENSP00000244050	SNAI1	Zinc finger protein SNAI1; Involved in induction of the epithelial to mesenchymal transition (EMT), formation and maintenance of embryonic mesoderm, growth arrest, survival and cell migration. Binds to 3 E-boxes of the E-cadherin/CDH1 gene promoter and to the promoters of CLDN7 and KRT8 and, in association with histone demethylase KDM1A which it recruits to the promoters, causes a decrease in dimethylated H3K4 levels and represses transcription. Associates with EGR1 and SP1 to mediate tetradecanoyl phorbol acetate (TPA)-induced up- regulation of CDKN2B, possibly by binding to the CDKN2 [...] 
73	GGA3	9606.ENSP00000438085	GGA3	Golgi associated, gamma adaptin ear containing, arf binding protein 3; ADP-ribosylation factor-binding protein GGA3; Plays a role in protein sorting and trafficking between the trans-Golgi network (TGN) and endosomes. Mediates the ARF- dependent recruitment of clathrin to the TGN and binds ubiquitinated proteins and membrane cargo molecules with a cytosolic acidic cluster-dileucine (AC-LL) motif
74	ARMC7	9606.ENSP00000245543	ARMC7	Armadillo repeat-containing protein 7; Armadillo repeat containing 7
75	FOSB	9606.ENSP00000245919	FOSB	Fosb proto-oncogene, ap-1 transcription factor subunit; Protein fosB; FosB interacts with Jun proteins enhancing their DNA binding activity; Belongs to the bZIP family. Fos subfamily
76	ZNF133	9606.ENSP00000439427	ZNF133	Zinc finger protein 133; May be involved in transcriptional regulation as a repressor; Zinc fingers C2H2-type
77	FLRT3	9606.ENSP00000367292	FLRT3	Leucine-rich repeat transmembrane protein FLRT3; Functions in cell-cell adhesion, cell migration and axon guidance, exerting an attractive or repulsive role depending on its interaction partners. Plays a role in the spatial organization of brain neurons. Plays a role in vascular development in the retina (By similarity). Plays a role in cell-cell adhesion via its interaction with ADGRL3 and probably also other latrophilins that are expressed at the surface of adjacent cells. Interaction with the intracellular domain of ROBO1 mediates axon attraction towards cells expressing NTN1. Media [...] 
78	DYRK2	9606.ENSP00000342105	DYRK2	Dual specificity tyrosine-phosphorylation-regulated kinase 2; Serine/threonine-protein kinase involved in the regulation of the mitotic cell cycle, cell proliferation, apoptosis, organization of the cytoskeleton and neurite outgrowth. Functions in part via its role in ubiquitin-dependent proteasomal protein degradation. Functions downstream of ATM and phosphorylates p53/TP53 at 'Ser-46', and thereby contributes to the induction of apoptosis in response to DNA damage. Phosphorylates NFATC1, and thereby inhibits its accumulation in the nucleus and its transcription factor activity. Phosp [...] 
79	LIF	9606.ENSP00000249075	LIF	Lif, interleukin 6 family cytokine; Leukemia inhibitory factor; LIF has the capacity to induce terminal differentiation in leukemic cells. Its activities include the induction of hematopoietic differentiation in normal and myeloid leukemia cells, the induction of neuronal cell differentiation, and the stimulation of acute-phase protein synthesis in hepatocytes; Endogenous ligands
80	KLF16	9606.ENSP00000250916	KLF16	Krueppel-like factor 16; Transcription factor that binds GC and GT boxes and displaces Sp1 and Sp3 from these sequences. Modulates dopaminergic transmission in the brain (By similarity); Kruppel like factors
81	LDLR	9606.ENSP00000454071	LDLR	Low-density lipoprotein receptor; Binds LDL, the major cholesterol-carrying lipoprotein of plasma, and transports it into cells by endocytosis. In order to be internalized, the receptor-ligand complexes must first cluster into clathrin-coated pits; Belongs to the LDLR family
82	ZSWIM6	9606.ENSP00000252744	ZSWIM6	Zinc finger swim domain-containing protein 6; Zinc finger SWIM-type containing 6
83	MED18	9606.ENSP00000362948	MED18	Mediator of RNA polymerase II transcription subunit 18; Component of the Mediator complex, a coactivator involved in the regulated transcription of nearly all RNA polymerase II-dependent genes. Mediator functions as a bridge to convey information from gene-specific regulatory proteins to the basal RNA polymerase II transcription machinery. Mediator is recruited to promoters by direct interactions with regulatory proteins and serves as a scaffold for the assembly of a functional preinitiation complex with RNA polymerase II and the general transcription factors
84	AKAP12	9606.ENSP00000384537	AKAP12	A-kinase anchor protein 12; Anchoring protein that mediates the subcellular compartmentation of protein kinase A (PKA) and protein kinase C (PKC); A-kinase anchoring proteins
85	UBE2G1	9606.ENSP00000380178	UBE2G1	Ubiquitin-conjugating enzyme E2 G1; Accepts ubiquitin from the E1 complex and catalyzes its covalent attachment to other proteins. In vitro catalyzes 'Lys- 48'-, as well as 'Lys-63'-linked polyubiquitination. May be involved in degradation of muscle-specific proteins. Mediates polyubiquitination of CYP3A4; Ubiquitin conjugating enzymes E2
86	KDM6B	9606.ENSP00000254846	KDM6B	Lysine-specific demethylase 6B; Histone demethylase that specifically demethylates 'Lys- 27' of histone H3, thereby playing a central role in histone code. Demethylates trimethylated and dimethylated H3 'Lys-27'. Plays a central role in regulation of posterior development, by regulating HOX gene expression. Involved in inflammatory response by participating in macrophage differentiation in case of inflammation by regulating gene expression and macrophage differentiation. Plays a demethylase-independent role in chromatin remodeling to regulate T-box family member-dependent gene expressi [...] 
87	USPL1	9606.ENSP00000255304	USPL1	Ubiquitin specific peptidase like 1; SUMO-specific isopeptidase USPL1; SUMO-specific isopeptidase involved in protein desumoylation. Specifically binds SUMO proteins with a higher affinity for SUMO2 and SUMO3 which it cleaves more efficiently. Also able to process full-length SUMO proteins to their mature forms. Plays a key role in RNA polymerase-II- mediated snRNA transcription in the Cajal bodies. Is a component of complexes that can bind to U snRNA genes
88	BHLHE40	9606.ENSP00000256495	BHLHE40	Class E basic helix-loop-helix protein 40; Transcriptional repressor involved in the regulation of the circadian rhythm by negatively regulating the activity of the clock genes and clock-controlled genes. Acts as the negative limb of a novel autoregulatory feedback loop (DEC loop) which differs from the one formed by the PER and CRY transcriptional repressors (PER/CRY loop). Both these loops are interlocked as it represses the expression of PER1/2 and in turn is repressed by PER1/2 and CRY1/2. Represses the activity of the circadian transcriptional activator: CLOCK-ARNTL/BMAL1|ARNTL2/B [...] 
89	ETS1	9606.ENSP00000376436	ETS1	Ets proto-oncogene 1, transcription factor; Protein C-ets-1; Transcription factor. Directly controls the expression of cytokine and chemokine genes in a wide variety of different cellular contexts. May control the differentiation, survival and proliferation of lymphoid cells. May also regulate angiogenesis through regulation of expression of genes controlling endothelial cell migration and invasion
90	ZC3H10	9606.ENSP00000257940	ZC3H10	Zinc finger CCCH domain-containing protein 10; Specific regulator of miRNA biogenesis. Binds, via the C3H1-type zinc finger domains, to the binding motif 5'-GCAGCGC-3' on microRNA pri-MIR143 and negatively regulates the processing to mature microRNA; Zinc fingers CCCH-type
91	SPRY2	9606.ENSP00000366306	SPRY2	Protein sprouty homolog 2; May function as an antagonist of fibroblast growth factor (FGF) pathways and may negatively modulate respiratory organogenesis; Belongs to the sprouty family
92	SKIL	9606.ENSP00000415243	SKIL	Ski-like protein; May have regulatory role in cell division or differentiation in response to extracellular signals; Belongs to the SKI family
93	LRRC1	9606.ENSP00000359925	LRRC1	Leucine-rich repeat-containing protein 1; Leucine rich repeat containing 1
94	CPEB2	9606.ENSP00000443985	CPEB2	Cytoplasmic polyadenylation element-binding protein 2; May play a role in translational regulation of stored mRNAs in transcriptionally inactive haploid spermatids. Binds to poly(U) RNA oligomers (By similarity). Required for cell cycle progression, specifically for the transition from metaphase to anaphase; Belongs to the RRM CPEB family
95	DUSP5	9606.ENSP00000358596	DUSP5	Dual specificity protein phosphatase 5; Dual specificity protein phosphatase; active with phosphotyrosine, phosphoserine and phosphothreonine residues. The highest relative activity is toward ERK1; MAP kinase phosphatases
96	RGS3	9606.ENSP00000363255	RGS3	Regulator of G-protein signaling 3; Down-regulates signaling from heterotrimeric G-proteins by increasing the GTPase activity of the alpha subunits, thereby driving them into their inactive GDP-bound form. Down-regulates G- protein-mediated release of inositol phosphates and activation of MAP kinases; C2 domain containing
97	MAN2C1	9606.ENSP00000457788	MAN2C1	Alpha-mannosidase 2C1; Cleaves alpha 1,2-, alpha 1,3-, and alpha 1,6-linked mannose residues from glycoproteins. Involved in the degradation of free oligosaccharides in the cytoplasm; Belongs to the glycosyl hydrolase 38 family
98	ZCCHC2	9606.ENSP00000269499	ZCCHC2	Zinc finger cchc domain-containing protein 2; Zinc finger CCHC-type containing 2
99	ZNF687	9606.ENSP00000319829	ZNF687	Zinc finger protein 687; May be involved in transcriptional regulation
100	DYRK3	9606.ENSP00000356076	DYRK3	Dual specificity tyrosine-phosphorylation-regulated kinase 3; Dual-specificity kinase which possesses both serine/threonine and tyrosine kinase activities. Negative regulator of EPO-dependent erythropoiesis, may place an upper limit on red cell production during stress erythropoiesis. Inhibits cell death due to cytokine withdrawal in hematopoietic progenitor cells. May act by regulating CREB/CRE signaling (By similarity). Stabilizes and prevents stress granule disassembly thereby regulating mTORC1 signaling during cellular stress. During stressful conditions, DYRK3 partitions to the st [...] 
101	DUSP10	9606.ENSP00000355866	DUSP10	Dual specificity protein phosphatase 10; Protein phosphatase involved in the inactivation of MAP kinases. Has a specificity for the MAPK11/MAPK12/MAPK13/MAPK14 subfamily. It preferably dephosphorylates p38
102	TP53BP2	9606.ENSP00000341957	TP53BP2	Apoptosis-stimulating of p53 protein 2; Regulator that plays a central role in regulation of apoptosis and cell growth via its interactions. Regulates TP53 by enhancing the DNA binding and transactivation function of TP53 on the promoters of proapoptotic genes in vivo. Inhibits the ability of APPBP1 to conjugate NEDD8 to CUL1, and thereby decreases APPBP1 ability to induce apoptosis. Impedes cell cycle progression at G2/M. Its apoptosis-stimulating activity is inhibited by its interaction with DDX42; Belongs to the ASPP family
103	SNAP47	9606.ENSP00000314157	SNAP47	Synaptosomal-associated protein 47; Plays a role in intracellular membrane fusion
104	ETAA1	9606.ENSP00000272342	ETAA1	Ewing's tumor-associated antigen 1; Replication stress response protein that accumulates at DNA damage sites and promotes replication fork progression and integrity. Recruited to stalled replication forks via interaction with the RPA complex and directly stimulates ATR kinase activity independently of TOPBP1. Probably only regulates a subset of ATR targets
105	TMEM177	9606.ENSP00000402661	TMEM177	Transmembrane protein 177; Plays a role in the early steps of cytochrome c oxidase subunit II (MT-CO2/COX2) maturation and is required for the stabilization of COX20 and the newly synthesized MT-CO2/COX2 protein
106	AMMECR1L	9606.ENSP00000272647	AMMECR1L	AMMECR1-like protein; AMMECR1 like
107	EAF1	9606.ENSP00000380054	EAF1	ELL-associated factor 1; Acts as a transcriptional transactivator of ELL and ELL2 elongation activities; Belongs to the EAF family
108	CSRNP1	9606.ENSP00000273153	CSRNP1	Cysteine/serine-rich nuclear protein 1; Binds to the consensus sequence 5'-AGAGTG-3' and has transcriptional activator activity (By similarity). May have a tumor-suppressor function. May play a role in apoptosis; Belongs to the AXUD1 family
109	SLC26A1	9606.ENSP00000354721	SLC26A1	Sulfate anion transporter 1; Mediates sulfate transport with high affinity. Mediates oxalate transport. Mediates bicarbonate transport (By similarity). Does not accept succinate as cosubstrate (By similarity); Solute carriers
110	TIAM2	9606.ENSP00000437188	TIAM2	T-lymphoma invasion and metastasis-inducing protein 2; Modulates the activity of RHO-like proteins and connects extracellular signals to cytoskeletal activities. Acts as a GDP- dissociation stimulator protein that stimulates the GDP-GTP exchange activity of RHO-like GTPases and activates them. Mediates extracellular laminin signals to activate Rac1, contributing to neurite growth. Involved in lamellipodial formation and advancement of the growth cone of embryonic hippocampal neurons. Promotes migration of neurons in the cerebral cortex. When overexpressed, induces membrane ruffling acc [...] 
111	SLC25A25	9606.ENSP00000362159	SLC25A25	Solute carrier family 25 (mitochondrial phosphate transporter), member 23/24/25/41; Calcium-binding mitochondrial carrier protein SCaMC-2; Calcium-dependent mitochondrial solute carrier. Mitochondrial solute carriers shuttle metabolites, nucleotides, and cofactors through the mitochondrial inner membrane. May act as a ATP-Mg/Pi exchanger that mediates the transport of Mg-ATP in exchange for phosphate, catalyzing the net uptake or efflux of adenine nucleotides into or from the mitochondria
112	ZNF214	9606.ENSP00000278314	ZNF214	Zinc finger protein 214; May be involved in transcriptional regulation; Zinc fingers C2H2-type
113	ZC3H12C	9606.ENSP00000278590	ZC3H12C	Zinc finger ccch-type containing 12c; Probable ribonuclease ZC3H12C; May function as RNase and regulate the levels of target RNA species; Belongs to the ZC3H12 family
114	CACNA1C	9606.ENSP00000266376	CACNA1C	Voltage-dependent L-type calcium channel subunit alpha-1C; Voltage-sensitive calcium channels (VSCC) mediate the entry of calcium ions into excitable cells and are also involved in a variety of calcium-dependent processes, including muscle contraction, hormone or neurotransmitter release, gene expression, cell motility, cell division and cell death. The isoform alpha-1C gives rise to L-type calcium currents. Long-lasting (L-type) calcium channels belong to the 'high-voltage activated' (HVA) group. They are blocked by dihydropyridines (DHP), phenylalkylamines, benzothiazepines, and by o [...] 
115	PLEKHH2	9606.ENSP00000282406	PLEKHH2	Pleckstrin homology domain-containing family H member 2; In the kidney glomerulus may play a role in linking podocyte foot processes to the glomerular basement membrane. May be involved in stabilization of F-actin by attenuating its depolymerization. Can recruit TGFB1I1 from focal adhesions to podocyte lamellipodia; FERM domain containing
116	DGKE	9606.ENSP00000284061	DGKE	Diacylglycerol kinase epsilon; Highly selective for arachidonate-containing species of diacylglycerol (DAG). May terminate signals transmitted through arachidonoyl-DAG or may contribute to the synthesis of phospholipids with defined fatty acid composition
117	KLF10	9606.ENSP00000285407	KLF10	Krueppel-like factor 10; Transcriptional repressor which binds to the consensus sequence 5'-GGTGTG-3'. Plays a role in the regulation of the circadian clock; binds to the GC box sequence in the promoter of the core clock component ARTNL/BMAL1 and represses its transcriptional activity. Regulates the circadian expression of genes involved in lipogenesis, gluconeogenesis, and glycolysis in the liver. Represses the expression of PCK2, a rate-limiting step enzyme of gluconeogenesis (By similarity). May play a role in the cell cycle regulation; Belongs to the Sp1 C2H2-type zinc-finger prote [...] 
118	ELMO1	9606.ENSP00000312185	ELMO1	Engulfment and cell motility protein 1; Involved in cytoskeletal rearrangements required for phagocytosis of apoptotic cells and cell motility. Acts in association with DOCK1 and CRK. Was initially proposed to be required in complex with DOCK1 to activate Rac Rho small GTPases. May enhance the guanine nucleotide exchange factor (GEF) activity of DOCK1
119	CPT2	9606.ENSP00000360541	CPT2	Carnitine O-palmitoyltransferase 2, mitochondrial; Carnitine palmitoyltransferase 2
120	ZNF19	9606.ENSP00000288177	ZNF19	Zinc finger protein 19; May be involved in transcriptional regulation; Zinc fingers C2H2-type
121	BRAF	9606.ENSP00000288602	BRAF	B-raf proto-oncogene serine/threonine-protein kinase; Serine/threonine-protein kinase B-raf; Protein kinase involved in the transduction of mitogenic signals from the cell membrane to the nucleus. May play a role in the postsynaptic responses of hippocampal neuron. Phosphorylates MAP2K1, and thereby contributes to the MAP kinase signal transduction pathway
122	AP3S2	9606.ENSP00000338777	AP3S2	AP-3 complex subunit sigma-2; Part of the AP-3 complex, an adaptor-related complex which is not clathrin-associated. The complex is associated with the Golgi region as well as more peripheral structures. It facilitates the budding of vesicles from the Golgi membrane and may be directly involved in trafficking to lysosomes. In concert with the BLOC-1 complex, AP-3 is required to target cargos into vesicles assembled at cell bodies for delivery into neurites and nerve terminals
123	PAFAH2	9606.ENSP00000363400	PAFAH2	Platelet-activating factor acetylhydrolase 2, cytoplasmic; Has a marked selectivity for phospholipids with short acyl chains at the sn-2 position. May share a common physiologic function with the plasma-type enzyme
124	B4GALT5	9606.ENSP00000360776	B4GALT5	Beta-1,4-galactosyltransferase 5; Responsible for the synthesis of complex-type N-linked oligosaccharides in many glycoproteins as well as the carbohydrate moieties of glycolipids; Beta 4-glycosyltransferases
125	IQCC	9606.ENSP00000442291	IQCC	Iq domain-containing protein c; IQ motif containing C
126	ALKBH4	9606.ENSP00000292566	ALKBH4	Alpha-ketoglutarate-dependent dioxygenase alkB homolog 4; Dioxygenase that mediates demethylation of actin monomethylated at 'Lys-84' (K84me1), thereby acting as a regulator of actomyosin-processes. Demethylation of actin K84me1 is required for maintaining actomyosin dynamics supporting normal cleavage furrow ingression during cytokinesis and cell migration. May be involved in transcription regulation; Belongs to the alkB family
127	KLHL21	9606.ENSP00000366886	KLHL21	Kelch-like protein 21; Substrate-specific adapter of a BCR (BTB-CUL3-RBX1) E3 ubiquitin-protein ligase complex required for efficient chromosome alignment and cytokinesis. The BCR(KLHL21) E3 ubiquitin ligase complex regulates localization of the chromosomal passenger complex (CPC) from chromosomes to the spindle midzone in anaphase and mediates the ubiquitination of AURKB. Ubiquitination of AURKB by BCR(KLHL21) E3 ubiquitin ligase complex may not lead to its degradation by the proteasome; BTB domain containing
128	WDCP	9606.ENSP00000295148	C2orf44	WD repeat and coiled-coil-containing protein; Chromosome 2 open reading frame 44
129	AIM2	9606.ENSP00000357112	AIM2	Interferon-inducible protein AIM2; Involved in innate immune response by recognizing cytosolic double-stranded DNA and inducing caspase-1-activating inflammasome formation in macrophages. Upon binding to DNA is thought to undergo oligomerization and to associate with PYCARD initiating the recruitment of caspase-1 precusrsor and processing of interleukin-1 beta and interleukin-18. Detects cytosolic dsDNA of viral and bacterial origin in a non-sequence-specific manner. Can also trigger PYCARD-dependent, caspase-1-independent cell death that involves caspase-8 (By similarity). Tumor suppr [...] 
130	ATXN7	9606.ENSP00000439585	ATXN7	Ataxin-7; Acts as component of the STAGA transcription coactivator-HAT complex. Mediates the interaction of STAGA complex with the CRX and is involved in CRX-dependent gene activation. Necessary for microtubule cytoskeleton stabilization; Ataxins
131	ZC3H12A	9606.ENSP00000362179	ZC3H12A	Endoribonuclease ZC3H12A; Endoribonuclease involved in various biological functions such as cellular inflammatory response and immune homeostasis, glial differentiation of neuroprogenitor cells, cell death of cardiomyocytes, adipogenesis and angiogenesis. Functions as an endoribonuclease involved in mRNA decay. Modulates the inflammatory response by promoting the degradation of a set of translationally active cytokine-induced inflammation- related mRNAs, such as IL6 and IL12B, during the early phase of inflammation. Prevents aberrant T-cell-mediated immune reaction by degradation of mu [...] 
132	PRKCD	9606.ENSP00000378217	PRKCD	Protein kinase C delta type; Calcium-independent, phospholipid- and diacylglycerol (DAG)-dependent serine/threonine-protein kinase that plays contrasting roles in cell death and cell survival by functioning as a pro-apoptotic protein during DNA damage-induced apoptosis, but acting as an anti-apoptotic protein during cytokine receptor- initiated cell death, is involved in tumor suppression as well as survival of several cancers, is required for oxygen radical production by NADPH oxidase and acts as positive or negative regulator in platelet functional responses. Negatively regulates B c [...] 
133	SPRY1	9606.ENSP00000481675	SPRY1	Sprouty rtk signaling antagonist 1; Protein sprouty homolog 1; May function as an antagonist of fibroblast growth factor (FGF) pathways and may negatively modulate respiratory organogenesis
134	ANXA5	9606.ENSP00000296511	ANXA5	Annexin A5; This protein is an anticoagulant protein that acts as an indirect inhibitor of the thromboplastin-specific complex, which is involved in the blood coagulation cascade; Annexins
135	ZNF606	9606.ENSP00000343617	ZNF606	Zinc finger protein 606; May act as a transcriptional repressor; Zinc fingers C2H2-type
136	MIDN	9606.ENSP00000300952	MIDN	Midnolin; Facilitates ubiquitin-independent proteasomal degradation of polycomb protein CBX4. Plays a role in inhibiting the activity of glucokinase GCK and both glucose-induced and basal insulin secretion
137	ZNF701	9606.ENSP00000444339	ZNF701	Zinc finger protein 701; May be involved in transcriptional regulation; Zinc fingers C2H2-type
138	SERTAD3	9606.ENSP00000325414	SERTAD3	SERTA domain-containing protein 3; Strong transcriptional coactivator
139	NFKBID	9606.ENSP00000380109	NFKBID	NF-kappa-B inhibitor delta; May regulate the expression of IL-2, IL-6, and other cytokines through regulation on NF-kappa-B activity. Functions in the regulation of inflammatory responses. May also regulate TCR- induced negative selection of thymocytes (By similarity); Ankyrin repeat domain containing
140	MFSD2A	9606.ENSP00000361895	MFSD2A	Sodium-dependent lysophosphatidylcholine symporter 1; Sodium-dependent lysophosphatidylcholine (LPC) symporter, which plays an essential role for blood-brain barrier formation and function (By similarity). Specifically expressed in endothelium of the blood-brain barrier of micro-vessels and transports LPC into the brain (By similarity). Transport of LPC is essential because it constitutes the major mechanism by which docosahexaenoic acid (DHA), an omega-3 fatty acid that is essential for normal brain growth and cognitive function, enters the brain. Transports LPC carrying long-chain fa [...] 
141	FEM1B	9606.ENSP00000307298	FEM1B	Protein fem-1 homolog B; Component of an E3 ubiquitin-protein ligase complex, in which it may act as a substrate recognition subunit. Involved in apoptosis by acting as a death receptor-associated protein that mediates apoptosis. Also involved in glucose homeostasis in pancreatic islet. Functions as an adapter/mediator in replication stress-induced signaling that leads to the activation of CHEK1; Belongs to the fem-1 family
142	OTUD7A	9606.ENSP00000305926	OTUD7A	OTU domain-containing protein 7A; Has deubiquitinating activity towards 'Lys-11'-linked polyubiquitin chains; Belongs to the peptidase C64 family
143	IFFO2	9606.ENSP00000387941	IFFO2	Intermediate filament family orphan 2; Belongs to the intermediate filament family
144	PWWP2A	9606.ENSP00000305151	PWWP2A	PWWP domain-containing protein 2A; H2A.Z-specific chromatin binding protein which may play an important role in the neural crest stem cell migration and differentiation during early development. Also required for proper mitosis progression; PWWP domain containing
145	CDH2	9606.ENSP00000269141	CDH2	Cadherin-2; Cadherins are calcium-dependent cell adhesion proteins. They preferentially interact with themselves in a homophilic manner in connecting cells; cadherins may thus contribute to the sorting of heterogeneous cell types. Acts as a regulator of neural stem cells quiescence by mediating anchorage of neural stem cells to ependymocytes in the adult subependymal zone: upon cleavage by MMP24, CDH2-mediated anchorage is affected, leading to modulate neural stem cell quiescence. CDH2 may be involved in neuronal recognition mechanism. In hippocampal neurons, may regulate dendritic spi [...] 
146	JUNB	9606.ENSP00000303315	JUNB	Transcription factor jun-B; Transcription factor involved in regulating gene activity following the primary growth factor response. Binds to the DNA sequence 5'-TGA[CG]TCA-3'; Belongs to the bZIP family. Jun subfamily
