#queryIndex	queryItem	stringId	preferredName	annotation
147	SLC25A33	9606.ENSP00000306328	SLC25A33	Solute carrier family 25 member 33; Mitochondrial transporter that imports/exports pyrimidine nucleotides into and from mitochondria. Transports preferentially uracil, thymine, and cytosine (deoxy)nucleoside di- and triphosphates by an antiport mechanism. Also transports guanine but not adenine (deoxy)nucleotides. Is inhibited strongly by pyridoxal 5'-phosphate, 4,7-diphenyl-1,10- phenanthroline, tannic acid, and mercurials (mercury dichloride, mersalyl acid, p-hydroxymercuribenzoate). Participates in mitochondrial genome maintenance, regulation of mitochondrial membrane potential and  [...] 
148	NHLH1	9606.ENSP00000302189	NHLH1	Helix-loop-helix protein 1; May serve as DNA-binding protein and may be involved in the control of cell-type determination, possibly within the developing nervous system; Basic helix-loop-helix proteins
149	SLFN12	9606.ENSP00000378063	SLFN12	Schlafen family member 12; Belongs to the Schlafen family
150	MALT1	9606.ENSP00000319279	MALT1	Mucosa-associated lymphoid tissue lymphoma translocation protein 1; Enhances BCL10-induced activation of NF-kappa-B. Involved in nuclear export of BCL10. Binds to TRAF6, inducing TRAF6 oligomerization and activation of its ligase activity. Has ubiquitin ligase activity. MALT1-dependent BCL10 cleavage plays an important role in T-cell antigen receptor-induced integrin adhesion; Belongs to the peptidase C14B family
151	CEBPB	9606.ENSP00000305422	CEBPB	CCAAT/enhancer-binding protein beta; Important transcription factor regulating the expression of genes involved in immune and inflammatory responses. Plays also a significant role in adipogenesis, as well as in the gluconeogenic pathway, liver regeneration, and hematopoiesis. The consensus recognition site is 5'- T[TG]NNGNAA[TG]-3'. Its functional capacity is governed by protein interactions and post-translational protein modifications. During early embryogenesis, plays essential and redundant functions with CEBPA. Has a promitotic effect on many cell types such as hepatocytes and adip [...] 
152	RND1	9606.ENSP00000308461	RND1	Rho-related GTP-binding protein Rho6; Lacks intrinsic GTPase activity. Has a low affinity for GDP, and constitutively binds GTP. Controls rearrangements of the actin cytoskeleton. Induces the Rac-dependent neuritic process formation in part by disruption of the cortical actin filaments. Causes the formation of many neuritic processes from the cell body with disruption of the cortical actin filaments; Rho family GTPases
153	ZBTB21	9606.ENSP00000308759	ZBTB21	Zinc finger and BTB domain-containing protein 21; Acts as a transcription repressor; BTB domain containing
154	TRIB1	9606.ENSP00000312150	TRIB1	Tribbles homolog 1; Adapter protein involved in protein degradation by interacting with RFWD2/COP1 ubiquitin ligase. The RFWD2-binding motif is masked by autoinhibitory interactions with the protein kinase domain. Serves to alter RFWD2 substrate specificity by directing the activity of RFWD2 toward CEBPA. Binds selectively the recognition sequence of CEBPA. Regulates myeloid cell differentiation by altering the expression of CEBPA in a RFWD2- dependent manner (By similarity). Controls macrophage, eosinophil and neutrophil differentiation via the COP1-binding domain (By similarity). Int [...] 
155	PLK3	9606.ENSP00000361275	PLK3	Serine/threonine-protein kinase PLK3; Serine/threonine-protein kinase involved in cell cycle regulation, response to stress and Golgi disassembly. Polo-like kinases act by binding and phosphorylating proteins are that already phosphorylated on a specific motif recognized by the POLO box domains. Phosphorylates ATF2, BCL2L1, CDC25A, CDC25C, CHEK2, HIF1A, JUN, p53/TP53, p73/TP73, PTEN, TOP2A and VRK1. Involved in cell cycle regulation: required for entry into S phase and cytokinesis. Phosphorylates BCL2L1, leading to regulate the G2 checkpoint and progression to cytokinesis during mitosi [...] 
156	KLHL15	9606.ENSP00000332791	KLHL15	Kelch-like protein 15; Substrate-specific adapter for CUL3 E3 ubiquitin-protein ligase complex. Acts as an adapter for CUL3 to target the serine/threonine-protein phosphatase 2A (PP2A) subunit PPP2R5B for ubiquitination and subsequent proteasomal degradation, thus promoting exchange with other regulatory subunits. Acts as an adapter for CUL3 to target the DNA- end resection factor RBBP8/CtIP for ubiquitination and subsequent proteasomal degradation. Through the regulation of RBBP8/CtIP protein turnover, plays a key role in DNA damage response, favoring DNA double-strand repair through  [...] 
157	DDIT3	9606.ENSP00000448665	DDIT3	DNA damage-inducible transcript 3 protein; Multifunctional transcription factor in ER stress response. Plays an essential role in the response to a wide variety of cell stresses and induces cell cycle arrest and apoptosis in response to ER stress. Plays a dual role both as an inhibitor of CCAAT/enhancer-binding protein (C/EBP) function and as an activator of other genes. Acts as a dominant-negative regulator of C/EBP-induced transcription: dimerizes with members of the C/EBP family, impairs their association with C/EBP binding sites in the promoter regions, and inhibits the expression  [...] 
158	GAL3ST3	9606.ENSP00000308591	GAL3ST3	Galactose-3-O-sulfotransferase 3; Transfers a sulfate to position 3 of non-reducing beta- galactosyl residues in N-glycans and core2-branched O-glycans. Has high activity towards Gal-beta-1,4-GlcNAc, Gal-beta-1,4(Fuc-alpha- 1,3)GlcNAc and lower activity towards Gal-beta-1,3(Fuc-alpha- 1,4)GlcNAc; Belongs to the galactose-3-O-sulfotransferase family
159	CLCF1	9606.ENSP00000309338	CLCF1	Cardiotrophin-like cytokine factor 1; Cytokine with B-cell stimulating capability. Binds to and activates the ILST/gp130 receptor; Interleukin 6 type cytokine family
160	LIPT2	9606.ENSP00000309463	LIPT2	Putative lipoyltransferase 2, mitochondrial; Catalyzes the transfer of endogenously produced octanoic acid from octanoyl-acyl-carrier-protein onto the lipoyl domains of lipoate-dependent enzymes, which catalyze essential redox reactions. Lipoyl-ACP can also act as a substrate although octanoyl-ACP is likely to be the physiological substrate (By similarity); Belongs to the LipB family
161	FOSL1	9606.ENSP00000310170	FOSL1	Fos-related antigen 1; FOS like 1, AP-1 transcription factor subunit; Belongs to the bZIP family. Fos subfamily
162	TMEM39A	9606.ENSP00000326063	TMEM39A	Transmembrane protein 39A; Belongs to the TMEM39 family
163	CCDC71	9606.ENSP00000319006	CCDC71	Coiled-coil domain-containing protein 71; Coiled-coil domain containing 71
164	HIC1	9606.ENSP00000314080	HIC1	Hypermethylated in cancer 1 protein; Transcriptional repressor. Recognizes and binds to the consensus sequence '5-[CG]NG[CG]GGGCA[CA]CC-3'. May act as a tumor suppressor. May be involved in development of head, face, limbs and ventral body wall. Involved in down-regulation of SIRT1 and thereby is involved in regulation of p53/TP53-dependent apoptotic DNA-damage responses. The specific target gene promoter association seems to be depend on corepressors, such as CTBP1 or CTBP2 and MTA1. The regulation of SIRT1 transcription in response to nutrient deprivation seems to involve CTBP1. In c [...] 
165	TGIF1	9606.ENSP00000327959	TGIF1	Homeobox protein TGIF1; Binds to a retinoid X receptor (RXR) responsive element from the cellular retinol-binding protein II promoter (CRBPII- RXRE). Inhibits the 9-cis-retinoic acid-dependent RXR alpha transcription activation of the retinoic acid responsive element. Active transcriptional corepressor of SMAD2. Links the nodal signaling pathway to the bifurcation of the forebrain and the establishment of ventral midline structures. May participate in the transmission of nuclear signals during development and in the adult, as illustrated by the down-modulation of the RXR alpha activiti [...] 
166	ZNF620	9606.ENSP00000322265	ZNF620	Zinc finger protein 620; May be involved in transcriptional regulation; Zinc fingers C2H2-type
167	TSSK6	9606.ENSP00000466477	TSSK6	Testis-specific serine/threonine-protein kinase 6; Required for sperm production and function. Plays a role in DNA condensation during postmeiotic chromatin remodeling (By similarity)
168	PER1	9606.ENSP00000314420	PER1	Period circadian protein homolog 1; Transcriptional repressor which forms a core component of the circadian clock. The circadian clock, an internal time- keeping system, regulates various physiological processes through the generation of approximately 24 hour circadian rhythms in gene expression, which are translated into rhythms in metabolism and behavior. It is derived from the Latin roots 'circa' (about) and 'diem' (day) and acts as an important regulator of a wide array of physiological functions including metabolism, sleep, body temperature, blood pressure, endocrine, immune, card [...] 
170	EGR3	9606.ENSP00000318057	EGR3	Early growth response protein 3; Probable transcription factor involved in muscle spindle development; Belongs to the EGR C2H2-type zinc-finger protein family
171	SERTAD2	9606.ENSP00000326933	SERTAD2	SERTA domain-containing protein 2; Acts at E2F-responsive promoters as coregulator to integrate signals provided by PHD- and/or bromodomain-containing transcription factors. May act as coactivator as well as corepressor of E2F1-TFDP1 and E2F4-TFDP1 complexes on E2F consensus binding sites, which would activate or inhibit E2F- target genes expression. Modulates fat storage by down-regulating the expression of key genes involved in adipocyte lipolysis, thermogenesis and oxidative metabolism
172	NKPD1	9606.ENSP00000321976	NKPD1	Ntpase kap family p-loop domain-containing protein 1; NTPase KAP family P-loop domain containing 1
175	HARBI1	9606.ENSP00000317743	HARBI1	Putative nuclease HARBI1; Transposase-derived protein that may have nuclease activity (Potential). Does not have transposase activity; DNA transposon derived genes
176	ZFP41	9606.ENSP00000327427	ZFP41	ZFP41 zinc finger protein; A putative DNA-binding regulatory protein associated with meiosis in spermatogenesis; Zinc fingers C2H2-type
177	C16orf72	9606.ENSP00000331720	C16orf72	UPF0472 protein C16orf72; Chromosome 16 open reading frame 72
178	FANCF	9606.ENSP00000330875	FANCF	Fanconi anemia group F protein; DNA repair protein that may operate in a postreplication repair or a cell cycle checkpoint function. May be implicated in interstrand DNA cross-link repair and in the maintenance of normal chromosome stability (By similarity); Fanconi anemia complementation groups
179	BCOR	9606.ENSP00000367705	BCOR	BCL-6 corepressor; Transcriptional corepressor. May specifically inhibit gene expression when recruited to promoter regions by sequence- specific DNA-binding proteins such as BCL6 and MLLT3. This repression may be mediated at least in part by histone deacetylase activities which can associate with this corepressor. Involved in the repression of TFAP2A; impairs binding of BCL6 and KDM2B to TFAP2A promoter regions. Via repression of TFAP2A acts as a negative regulator of osteo-dentiogenic capacity in adult stem cells; the function implies inhibition of methylation on histone H3 'Lys-4' ( [...] 
181	SS18L1	9606.ENSP00000333012	SS18L1	SS18L1 subunit of BAF chromatin remodeling complex; Calcium-responsive transactivator; Transcriptional activator which is required for calcium- dependent dendritic growth and branching in cortical neurons. Recruits CREB-binding protein (CREBBP) to nuclear bodies. Component of the CREST-BRG1 complex, a multiprotein complex that regulates promoter activation by orchestrating a calcium-dependent release of a repressor complex and a recruitment of an activator complex. In resting neurons, transcription of the c-FOS promoter is inhibited by BRG1-dependent recruitment of a phospho-RB1-HDAC1  [...] 
182	TMEM186	9606.ENSP00000331640	TMEM186	Transmembrane protein 186
183	MAFF	9606.ENSP00000345393	MAFF	Transcription factor MafF; Interacts with the upstream promoter region of the oxytocin receptor gene. May be a transcriptional enhancer in the up-regulation of the oxytocin receptor gene at parturition. Since it lacks a putative transactivation domain, it may behave as a transcriptional repressor when it dimerize among himself. May also serve as a transcriptional activator by dimerizing with other (usually larger) basic-zipper proteins and recruiting them to specific DNA-binding sites. May be involved in the cellular stress response; Belongs to the bZIP family. Maf subfamily
184	CYP2R1	9606.ENSP00000334592	CYP2R1	Vitamin D 25-hydroxylase; Has a D-25-hydroxylase activity on both forms of vitamin D, vitamin D(2) and D(3); Cytochrome P450 family 2
185	INSIG1	9606.ENSP00000344741	INSIG1	Insulin-induced gene 1 protein; Mediates feedback control of cholesterol synthesis by controlling SCAP and HMGCR. Functions by blocking the processing of sterol regulatory element-binding proteins (SREBPs). Capable of retaining the SCAP-SREBF2 complex in the ER thus preventing it from escorting SREBPs to the Golgi. Initiates the sterol-mediated ubiquitin-mediated endoplasmic reticulum-associated degradation (ERAD) of HMGCR via recruitment of the reductase to the ubiquitin ligase, AMFR/gp78. May play a role in growth and differentiation of tissues involved in metabolic control. May play [...] 
187	SPRY4	9606.ENSP00000344967	SPRY4	Sprouty rtk signaling antagonist 4; Protein sprouty homolog 4; Suppresses the insulin receptor and EGFR-transduced MAPK signaling pathway, but does not inhibit MAPK activation by a constitutively active mutant Ras. Probably impairs the formation of GTP-Ras. Inhibits Ras-independent, but not Ras-dependent, activation of RAF1
188	DCUN1D3	9606.ENSP00000319482	DCUN1D3	Defective in cullin neddylation 1 domain containing 3; DCN1-like protein 3; Antagonizes DCUN1D1-mediated CUL1 neddylation by sequestering CUL1 at the cell membrane. When overexpressed in transformed cells, may promote mesenchymal to epithelial-like changes and inhibit colony formation in soft agar
189	IER5L	9606.ENSP00000361569	IER5L	Immediate early response gene 5-like protein; Immediate early response 5 like
190	ZNF563	9606.ENSP00000293725	ZNF563	Zinc finger protein 563; May be involved in transcriptional regulation; Zinc fingers C2H2-type
191	GREB1	9606.ENSP00000370896	GREB1	Growth regulation by estrogen in breast cancer 1; Protein GREB1; May play a role in estrogen-stimulated cell proliferation. Acts as a regulator of hormone-dependent cancer growth in breast and prostate cancers
192	ASB13	9606.ENSP00000350331	ASB13	Ankyrin repeat and SOCS box protein 13; May be a substrate-recognition component of a SCF-like ECS (Elongin-Cullin-SOCS-box protein) E3 ubiquitin-protein ligase complex which mediates the ubiquitination and subsequent proteasomal degradation of target proteins; Ankyrin repeat domain containing
193	HRH1	9606.ENSP00000380247	HRH1	Histamine H1 receptor; In peripheral tissues, the H1 subclass of histamine receptors mediates the contraction of smooth muscles, increase in capillary permeability due to contraction of terminal venules, and catecholamine release from adrenal medulla, as well as mediating neurotransmission in the central nervous system
194	ZKSCAN5	9606.ENSP00000377725	ZKSCAN5	Zinc finger protein with KRAB and SCAN domains 5; May be involved in transcriptional regulation; SCAN domain containing
195	TTC30B	9606.ENSP00000386181	TTC30B	Tetratricopeptide repeat protein 30B; Required for polyglutamylation of axonemal tubulin. Plays a role in anterograde intraflagellar transport (IFT), the process by which cilia precursors are transported from the base of the cilium to the site of their incorporation at the tip
196	ZFP62	9606.ENSP00000423820	ZFP62	Zinc finger protein 62 homolog; May play a role in differentiating skeletal muscle; Zinc fingers C2H2-type
197	ZNF418	9606.ENSP00000379451	ZNF418	Zinc finger protein 418; Transcriptional repressor; Zinc fingers C2H2-type
198	MAFG	9606.ENSP00000350369	MAFG	Transcription factor MafG; Since they lack a putative transactivation domain, the small Mafs behave as transcriptional repressors when they dimerize among themselves. However, they seem to serve as transcriptional activators by dimerizing with other (usually larger) basic-zipper proteins and recruiting them to specific DNA-binding sites. Small Maf proteins heterodimerize with Fos and may act as competitive repressors of the NF-E2 transcription factor. Transcription factor, component of erythroid-specific transcription factor NF- E2. Activates globin gene expression when associated with [...] 
199	TTC30A	9606.ENSP00000347915	TTC30A	Tetratricopeptide repeat protein 30A; Required for polyglutamylation of axonemal tubulin. Plays a role in anterograde intraflagellar transport (IFT), the process by which cilia precursors are transported from the base of the cilium to the site of their incorporation at the tip
200	NMB	9606.ENSP00000378089	NMB	Neuromedin-B; Stimulates smooth muscle contraction in a manner similar to that of bombesin; Belongs to the bombesin/neuromedin-B/ranatensin family
201	TAF13	9606.ENSP00000355051	TAF13	Transcription initiation factor TFIID subunit 13; Component of the DNA-binding general RNA polymerase II transcription factor IID complex (TFIID). TFIID plays a critical role in the regulation of gene transcription in eukaryotic cells; Belongs to the TAF13 family
202	FAM49A	9606.ENSP00000370724	FAM49A	Protein FAM49A; Family with sequence similarity 49 member A; Belongs to the FAM49 family
203	ZNF442	9606.ENSP00000242804	ZNF442	Zinc finger protein 442; May be involved in transcriptional regulation; Zinc fingers C2H2-type
204	ARC	9606.ENSP00000349022	ARC	Activity-regulated cytoskeleton-associated protein; Required for consolidation of synaptic plasticity as well as formation of long-term memory. Regulates endocytosis of AMPA receptors in response to synaptic activity. Required for homeostatic synaptic scaling of AMPA receptors (By similarity). Plays a role in the regulation of cell morphology and cytoskeletal organization. Required in the stress fiber dynamics and cell migration; Gag like LTR retrotransposon derived genes
206	ZNF616	9606.ENSP00000471000	ZNF616	Zinc finger protein 616; May be involved in transcriptional regulation; Zinc fingers C2H2-type
207	ZNF425	9606.ENSP00000367300	ZNF425	Zinc finger protein 425; Acts as a transcriptional repressor; Zinc fingers C2H2-type
208	SYT3	9606.ENSP00000340914	SYT3	Synaptotagmin-3; Ca(2+) sensor involved in Ca(2+)-dependent exocytosis of secretory vesicles through Ca(2+) and phospholipid binding to the C2 domain. Ca(2+) induces binding of the C2-domains to phospholipid membranes and to assembled SNARE-complexes; both actions contribute to triggering exocytosis (By similarity). Plays a role in dendrite formation by melanocytes; Synaptotagmins
209	RBMXL1	9606.ENSP00000446099	RBMXL1	RNA binding motif protein, X-linked-like-1; RNA-binding protein which may be involved in pre-mRNA splicing
210	HOMEZ	9606.ENSP00000350049	HOMEZ	Homeobox and leucine zipper protein Homez; May function as a transcriptional regulator; ZF class homeoboxes and pseudogenes
212	C3orf36	9606.ENSP00000386219	C3orf36	Uncharacterized protein C3orf36; Chromosome 3 open reading frame 36
220	ZNF879	9606.ENSP00000414887	ZNF879	Zinc finger protein 879; May be involved in transcriptional regulation; Zinc fingers C2H2-type
226	PSG4	9606.ENSP00000384770	PSG4	Pregnancy specific beta-1-glycoprotein 4
227	ZNF564	9606.ENSP00000340004	ZNF564	Zinc finger protein 564; May be involved in transcriptional regulation; Zinc fingers C2H2-type
229	ZNF225	9606.ENSP00000262894	ZNF225	Zinc finger protein 225; May be involved in transcriptional regulation; Zinc fingers C2H2-type
231	ZNF253	9606.ENSP00000468720	ZNF253	Zinc finger protein 253; May function as a transcription factor. Seem to have a transcriptional repression activity; Belongs to the krueppel C2H2-type zinc-finger protein family
250	ADRA2B	9606.ENSP00000480573	ADRA2B	Alpha-2B adrenergic receptor; Alpha-2 adrenergic receptors mediate the catecholamine- induced inhibition of adenylate cyclase through the action of G proteins. The rank order of potency for agonists of this receptor is clonidine > norepinephrine > epinephrine = oxymetazoline > dopamine > p-tyramine = phenylephrine > serotonin > p-synephrine / p-octopamine. For antagonists, the rank order is yohimbine > chlorpromazine > phentolamine > mianserine > spiperone > prazosin > alprenolol > propanolol > pindolol; Belongs to the G-protein coupled receptor 1 family. Adrenergic receptor subfamily. [...] 
251	ZNF658	9606.ENSP00000482540	ZNF658	Zinc finger protein 658; Mediates transcriptional repression in response to zinc. Represses several genes, including SLC30A5, SLC30A10 and CBWD1, by binding to the zinc transcriptional regulatory element (ZTRE) (5'- C[AC]C[TAG]CC[TC]-N(0-50)-[GA]G[ATC]G[TG]G-3') found in the promoter region. May play a role in the control of ribosome biogenesis, regulating predominantly rRNA levels, as well as those of several ribosomal proteins, thus coordinating this highly zinc- demanding process with the available zinc supply; Zinc fingers C2H2-type
254	MRM1	9606.ENSP00000481559	MRM1	21S rRNA (GM2251-2'-O)-methyltransferase; rRNA methyltransferase 1, mitochondrial; S-adenosyl-L-methionine-dependent 2'-O-ribose methyltransferase that catalyzes the formation of 2'-O- methylguanosine at position 1145 (Gm1145) in the 16S mitochondrial large subunit ribosomal RNA (mtLSU rRNA), a universally conserved modification in the peptidyl transferase domain of the mtLSU rRNA
